context|end|flags|hp_id|index|line|match|names|negated|pat_id|relevant|score|section|start
|761.0|{'associated'}|HP:0002037|0.0|Refractory very early-onset inflammatory bowel disease associated with cytosolic isoleucyl-tRNA synthetase deficiency: A case report.|inflammatory bowel disease|['Inflammation of the large intestine', 'Inflammation of the large intestine', 'Inflammatory bowel disease']|0.0|None|0.0|0.9901862|Unassigned|735.0
|125.0|{'associated'}|HP:0002037|1.0|DOI: https://www.wjgnet.com/1007-9327/full/v26/i15/1841.htm<br><br><br>Refractory very early-onset inflammatory bowel disease associated with cytosolic isoleucyl-tRNA synthetase deficiency: A case report<br>Advanced Search<br>BPG is committed to discovery and dissemination of knowledge<br>This Article<br>AddThis Sharing ButtonsShare to FacebookFacebookShare to TwitterTwitterShare to E-mailEmailShare to Meer... AddThis<br><h5><br>Academic Content and Language Evaluation of This Article<br><h5><br>CrossCheck and Google Search of This Article<br><h5><br>Academic Rules and Norms of This Article<br><h5><br>Citation of this article<br>Fagbemi A, Newman WG, Tangye SG, Hughes SM, Cheesman E, Arkwright PD.|inflammatory bowel disease|['Inflammation of the large intestine', 'Inflammation of the large intestine', 'Inflammatory bowel disease']|0.0|None|0.0|0.9901862|Unassigned|99.0
|993.0|set()|HP:0012393|2.0|2020: 26(15): 1841-1846<br><h5><br>Corresponding Author of This Article<br>Peter D Arkwright, MD, PhD, Senior Lecturer, Department of Paediatric Allergy and Immunology, Royal Manchester Children's Hospital, Oxford Road, Manchester M139WL, United Kingdom.|Allergy|['Allergy', 'Allergy']|0.0|None|0.0|0.9825028|Unassigned|986.0
(c)The Author(s) 2020.. Published by Baishideng Publishing Group Inc. All rights reserved.<br>World J Gastroenterol.. Apr 21, 2020: 26(15): 1841-1846<br>. Published online Apr 21, 2020. doi: 10.3748/wjg.v26.i15.1841<br>Refractory very early-onset inflammatory bowel disease associated with cytosolic isoleucyl-tRNA synthetase deficiency: A case report<br>Andrew Fagbemi, William G Newman, Stuart G Tangye, Stephen M Hughes, Edmund Cheesman, Peter D Arkwright<br>Andrew Fagbemi, Department of Paediatric Gastroenterology, Royal Manchester Children's Hospital, Manchester M199WL, United KingdomWilliam G Newman, Department of Medical Genetics, Manchester University NHS Foundation Trust, Manchester M139WL, United KingdomWilliam G Newman, Evolution and Genomic Sciences, University of Manchester, Manchester M139WL, United KingdomStuart G Tangye, Garvan Institute of Medical Research, Darlinghurst, NSW 2010, AustraliaStuart G Tangye, St Vincent's Clinical School, Faculty of Medicine, UNSW Australia, Sydney, NSW 2010, AustraliaStephen M Hughes, Peter D Arkwright, Department of Paediatric Allergy and Immunology, Royal Manchester Children's Hospital, Manchester M139WL, United KingdomEdmund Cheesman, Department of Paediatric Histopathology, St Mary's Hospital, Manchester M139WL, United KingdomPeter D Arkwright, Lydia Becker Institute of Immunology and Inflammation, University of Manchester, Manchester M139WL, United Kingdom<br>ORCID number: Andrew Fagbemi (0000-0002-3967-3777): William G Newman (0000-0002-6382-4678): Stuart G Tangye (0000-0002-5360-5180): Stephen M Hughes (0000-0001-9985-3908): Edmund Cheesman (0000-0001-5546-6965): Peter D Arkwright (0000-0002-7411-5375).<br>Author contributions:  Arkwright PD and Newman WG led the study concept and design: all authors were involved in acquisition of data: Arkwright PD, Newman WG, Cheesman E and Tangye SG analysed and interpreted the data: Arkwright PD drafted the manuscript and all authors critically reviewed the manuscript.<br>. Informed consent statement:  Informed consent was obtained from the child's parents for the publication of the report.. Conflict-of-interest statement:  The authors have declared no conflicts of interest.|1070.0|{'study', 'associated'}|HP:0012393|3.0|Published online Apr 21, 2020. doi: 10.3748/wjg.v26.i15.1841<br>Refractory very early-onset inflammatory bowel disease associated with cytosolic isoleucyl-tRNA synthetase deficiency: A case report<br>Andrew Fagbemi, William G Newman, Stuart G Tangye, Stephen M Hughes, Edmund Cheesman, Peter D Arkwright<br>Andrew Fagbemi, Department of Paediatric Gastroenterology, Royal Manchester Children's Hospital, Manchester M199WL, United KingdomWilliam G Newman, Department of Medical Genetics, Manchester University NHS Foundation Trust, Manchester M139WL, United KingdomWilliam G Newman, Evolution and Genomic Sciences, University of Manchester, Manchester M139WL, United KingdomStuart G Tangye, Garvan Institute of Medical Research, Darlinghurst, NSW 2010, AustraliaStuart G Tangye, St Vincent's Clinical School, Faculty of Medicine, UNSW Australia, Sydney, NSW 2010, AustraliaStephen M Hughes, Peter D Arkwright, Department of Paediatric Allergy and Immunology, Royal Manchester Children's Hospital, Manchester M139WL, United KingdomEdmund Cheesman, Department of Paediatric Histopathology, St Mary's Hospital, Manchester M139WL, United KingdomPeter D Arkwright, Lydia Becker Institute of Immunology and Inflammation, University of Manchester, Manchester M139WL, United Kingdom<br>ORCID number: Andrew Fagbemi (0000-0002-3967-3777): William G Newman (0000-0002-6382-4678): Stuart G Tangye (0000-0002-5360-5180): Stephen M Hughes (0000-0001-9985-3908): Edmund Cheesman (0000-0001-5546-6965): Peter D Arkwright (0000-0002-7411-5375).<br>Author contributions:  Arkwright PD and Newman WG led the study concept and design: all authors were involved in acquisition of data: Arkwright PD, Newman WG, Cheesman E and Tangye SG analysed and interpreted the data: Arkwright PD drafted the manuscript and all authors critically reviewed the manuscript.<br>|Allergy|['Allergy', 'Allergy']|0.0|None|0.0|0.9825028|Unassigned|1063.0
(c)The Author(s) 2020.. Published by Baishideng Publishing Group Inc. All rights reserved.<br>World J Gastroenterol.. Apr 21, 2020: 26(15): 1841-1846<br>. Published online Apr 21, 2020. doi: 10.3748/wjg.v26.i15.1841<br>Refractory very early-onset inflammatory bowel disease associated with cytosolic isoleucyl-tRNA synthetase deficiency: A case report<br>Andrew Fagbemi, William G Newman, Stuart G Tangye, Stephen M Hughes, Edmund Cheesman, Peter D Arkwright<br>Andrew Fagbemi, Department of Paediatric Gastroenterology, Royal Manchester Children's Hospital, Manchester M199WL, United KingdomWilliam G Newman, Department of Medical Genetics, Manchester University NHS Foundation Trust, Manchester M139WL, United KingdomWilliam G Newman, Evolution and Genomic Sciences, University of Manchester, Manchester M139WL, United KingdomStuart G Tangye, Garvan Institute of Medical Research, Darlinghurst, NSW 2010, AustraliaStuart G Tangye, St Vincent's Clinical School, Faculty of Medicine, UNSW Australia, Sydney, NSW 2010, AustraliaStephen M Hughes, Peter D Arkwright, Department of Paediatric Allergy and Immunology, Royal Manchester Children's Hospital, Manchester M139WL, United KingdomEdmund Cheesman, Department of Paediatric Histopathology, St Mary's Hospital, Manchester M139WL, United KingdomPeter D Arkwright, Lydia Becker Institute of Immunology and Inflammation, University of Manchester, Manchester M139WL, United Kingdom<br>ORCID number: Andrew Fagbemi (0000-0002-3967-3777): William G Newman (0000-0002-6382-4678): Stuart G Tangye (0000-0002-5360-5180): Stephen M Hughes (0000-0001-9985-3908): Edmund Cheesman (0000-0001-5546-6965): Peter D Arkwright (0000-0002-7411-5375).<br>Author contributions:  Arkwright PD and Newman WG led the study concept and design: all authors were involved in acquisition of data: Arkwright PD, Newman WG, Cheesman E and Tangye SG analysed and interpreted the data: Arkwright PD drafted the manuscript and all authors critically reviewed the manuscript.<br>. Informed consent statement:  Informed consent was obtained from the child's parents for the publication of the report.. Conflict-of-interest statement:  The authors have declared no conflicts of interest.|247.0|{'study', 'associated'}|HP:0002037|3.0|Published online Apr 21, 2020. doi: 10.3748/wjg.v26.i15.1841<br>Refractory very early-onset inflammatory bowel disease associated with cytosolic isoleucyl-tRNA synthetase deficiency: A case report<br>Andrew Fagbemi, William G Newman, Stuart G Tangye, Stephen M Hughes, Edmund Cheesman, Peter D Arkwright<br>Andrew Fagbemi, Department of Paediatric Gastroenterology, Royal Manchester Children's Hospital, Manchester M199WL, United KingdomWilliam G Newman, Department of Medical Genetics, Manchester University NHS Foundation Trust, Manchester M139WL, United KingdomWilliam G Newman, Evolution and Genomic Sciences, University of Manchester, Manchester M139WL, United KingdomStuart G Tangye, Garvan Institute of Medical Research, Darlinghurst, NSW 2010, AustraliaStuart G Tangye, St Vincent's Clinical School, Faculty of Medicine, UNSW Australia, Sydney, NSW 2010, AustraliaStephen M Hughes, Peter D Arkwright, Department of Paediatric Allergy and Immunology, Royal Manchester Children's Hospital, Manchester M139WL, United KingdomEdmund Cheesman, Department of Paediatric Histopathology, St Mary's Hospital, Manchester M139WL, United KingdomPeter D Arkwright, Lydia Becker Institute of Immunology and Inflammation, University of Manchester, Manchester M139WL, United Kingdom<br>ORCID number: Andrew Fagbemi (0000-0002-3967-3777): William G Newman (0000-0002-6382-4678): Stuart G Tangye (0000-0002-5360-5180): Stephen M Hughes (0000-0001-9985-3908): Edmund Cheesman (0000-0001-5546-6965): Peter D Arkwright (0000-0002-7411-5375).<br>Author contributions:  Arkwright PD and Newman WG led the study concept and design: all authors were involved in acquisition of data: Arkwright PD, Newman WG, Cheesman E and Tangye SG analysed and interpreted the data: Arkwright PD drafted the manuscript and all authors critically reviewed the manuscript.<br>|inflammatory bowel disease|['Inflammation of the large intestine', 'Inflammation of the large intestine', 'Inflammatory bowel disease']|0.0|None|0.0|0.9901862|Unassigned|221.0
CARE Checklist (2016) statement:  The authors have read the CARE Checklist (2016), and the manuscript was prepared and revised according to the CARE Checklist (2016).. Open-Access:  This article is an open-access article that was selected by an in-house editor and fully peer-reviewed by external reviewers.. It is distributed in accordance with the Creative Commons Attribution NonCommercial (CC BY-NC 4.0) license, which permits others to distribute, remix, adapt, build upon this work non-commercially, and license their derivative works on different terms, provided the original work is properly cited and the use is non-commercial.. See: http://creativecommons.org/licenses/by-nc/4.0/Corresponding author:  Peter D Arkwright, MD, PhD, Senior Lecturer, Department of Paediatric Allergy and Immunology, Royal Manchester Children's Hospital, Oxford Road, Manchester M139WL, United Kingdom.. peter.arkwright@manchester.ac.uk<br>. Received: January 6, 2020Peer-review started:  January 6, 2020First decision:  January 19, 2020Revised: March 26, 2020Accepted: April 1, 2020Article in press:  April 1, 2020Published online: April 21, 2020<br><h5><br>|2961.0|set()|HP:0012393|4.0|See: http://creativecommons.org/licenses/by-nc/4.0/Corresponding author:  Peter D Arkwright, MD, PhD, Senior Lecturer, Department of Paediatric Allergy and Immunology, Royal Manchester Children's Hospital, Oxford Road, Manchester M139WL, United Kingdom.|Allergy|['Allergy', 'Allergy']|0.0|None|0.0|0.9825028|Unassigned|2954.0
Abstract<br><h5>BACKGROUND</h5>. Aminoacyl tRNA synthetases/ligases (ARSs) are highly conserved enzymes involved in attaching amino acids to tRNA promoting protein synthesis.. Although deficiencies of ARSs localized to the mitochondria classically present with neuropathology, the clinical features of cytosolic ARS deficiencies are more variable.. They have previously been associated with neonatal hepatitis, but never with early-onset inflammatory bowel disease.<br>. <br>. <h5>CASE SUMMARY</h5>|3725.0|{'never', 'previously', 'associated'}|HP:0012115|5.0|They have previously been associated with neonatal hepatitis, but never with early-onset inflammatory bowel disease.<br>|hepatitis|['Hepatitis', 'Liver inflammation']|0.0|None|0.0|0.9798366|BACKGROUND|3716.0
Abstract<br><h5>BACKGROUND</h5>. Aminoacyl tRNA synthetases/ligases (ARSs) are highly conserved enzymes involved in attaching amino acids to tRNA promoting protein synthesis.. Although deficiencies of ARSs localized to the mitochondria classically present with neuropathology, the clinical features of cytosolic ARS deficiencies are more variable.. They have previously been associated with neonatal hepatitis, but never with early-onset inflammatory bowel disease.<br>. <br>. <h5>CASE SUMMARY</h5>|3780.0|{'never', 'previously', 'associated'}|HP:0002037|5.0|They have previously been associated with neonatal hepatitis, but never with early-onset inflammatory bowel disease.<br>|inflammatory bowel disease|['Inflammation of the large intestine', 'Inflammation of the large intestine', 'Inflammatory bowel disease']|0.0|None|0.0|0.9901862|BACKGROUND|3754.0
Cytokine assays demonstrated markedly elevated IL-2, IL-5, IL-13, IL-9 and IL-10 by the patient's CD4 T-cells, while IL-17A, IL-17F, IFNb were lower, and TNFa not significantly different when compared to healthy controls.<br>. <br>. <h5>CONCLUSION</h5>. This case report provides evidence that recessive mutations in cytosolic isoleucyl-tRNA synthetase are a novel monogenic cause of IBD, which should be considered, particularly in infants and children with a history of neonatal hepatitis and very early-onset IBD poorly responsive to treatment.<br>Key Words: Inflammatory bowel disease, Hepatitis, Gene, Cytosolic isoleucine tRNA synthase<br>Core tip: Consider cytosolic isoleucyl-tRNA synthetase in children presenting with neonatal hepatitis and refractory very early-onset inflammatory bowel disease.. This case report provides evidence for a novel monogenic cause of inflammatory bowel disease that should be considered, particularly in patients with very early-onset, poor response to treatment and a history of neonatal hepatitis.<br><h5>INTRODUCTION</h5>. Aminoacyl tRNA synthetases/ligases (ARSs) are a group of 20 ubiquitously expressed, highly conserved enzymes involved in attaching each specific amino acid to a tRNA to promote protein synthesis.|1692.0|{'report'}|HP:0002037|6.0|This case report provides evidence that recessive mutations in cytosolic isoleucyl-tRNA synthetase are a novel monogenic cause of IBD, which should be considered, particularly in infants and children with a history of neonatal hepatitis and very early-onset IBD poorly responsive to treatment.<br>Key Words: Inflammatory bowel disease, Hepatitis, Gene, Cytosolic isoleucine tRNA synthase<br>Core tip: Consider cytosolic isoleucyl-tRNA synthetase in children presenting with neonatal hepatitis and refractory very early-onset inflammatory bowel disease.|inflammatory bowel disease|['Inflammation of the large intestine', 'Inflammation of the large intestine', 'Inflammatory bowel disease']|0.0|None|1.0|0.9901862|CONCLUSION|1666.0
Cytokine assays demonstrated markedly elevated IL-2, IL-5, IL-13, IL-9 and IL-10 by the patient's CD4 T-cells, while IL-17A, IL-17F, IFNb were lower, and TNFa not significantly different when compared to healthy controls.<br>. <br>. <h5>CONCLUSION</h5>. This case report provides evidence that recessive mutations in cytosolic isoleucyl-tRNA synthetase are a novel monogenic cause of IBD, which should be considered, particularly in infants and children with a history of neonatal hepatitis and very early-onset IBD poorly responsive to treatment.<br>Key Words: Inflammatory bowel disease, Hepatitis, Gene, Cytosolic isoleucine tRNA synthase<br>Core tip: Consider cytosolic isoleucyl-tRNA synthetase in children presenting with neonatal hepatitis and refractory very early-onset inflammatory bowel disease.. This case report provides evidence for a novel monogenic cause of inflammatory bowel disease that should be considered, particularly in patients with very early-onset, poor response to treatment and a history of neonatal hepatitis.<br><h5>INTRODUCTION</h5>. Aminoacyl tRNA synthetases/ligases (ARSs) are a group of 20 ubiquitously expressed, highly conserved enzymes involved in attaching each specific amino acid to a tRNA to promote protein synthesis.|1633.0|{'report'}|HP:0012115|6.0|This case report provides evidence that recessive mutations in cytosolic isoleucyl-tRNA synthetase are a novel monogenic cause of IBD, which should be considered, particularly in infants and children with a history of neonatal hepatitis and very early-onset IBD poorly responsive to treatment.<br>Key Words: Inflammatory bowel disease, Hepatitis, Gene, Cytosolic isoleucine tRNA synthase<br>Core tip: Consider cytosolic isoleucyl-tRNA synthetase in children presenting with neonatal hepatitis and refractory very early-onset inflammatory bowel disease.|hepatitis|['Hepatitis', 'Liver inflammation']|0.0|None|1.0|0.9798366|CONCLUSION|1624.0
Cytokine assays demonstrated markedly elevated IL-2, IL-5, IL-13, IL-9 and IL-10 by the patient's CD4 T-cells, while IL-17A, IL-17F, IFNb were lower, and TNFa not significantly different when compared to healthy controls.<br>. <br>. <h5>CONCLUSION</h5>. This case report provides evidence that recessive mutations in cytosolic isoleucyl-tRNA synthetase are a novel monogenic cause of IBD, which should be considered, particularly in infants and children with a history of neonatal hepatitis and very early-onset IBD poorly responsive to treatment.<br>Key Words: Inflammatory bowel disease, Hepatitis, Gene, Cytosolic isoleucine tRNA synthase<br>Core tip: Consider cytosolic isoleucyl-tRNA synthetase in children presenting with neonatal hepatitis and refractory very early-onset inflammatory bowel disease.. This case report provides evidence for a novel monogenic cause of inflammatory bowel disease that should be considered, particularly in patients with very early-onset, poor response to treatment and a history of neonatal hepatitis.<br><h5>INTRODUCTION</h5>. Aminoacyl tRNA synthetases/ligases (ARSs) are a group of 20 ubiquitously expressed, highly conserved enzymes involved in attaching each specific amino acid to a tRNA to promote protein synthesis.|1377.0|{'report'}|HP:0012115|6.0|This case report provides evidence that recessive mutations in cytosolic isoleucyl-tRNA synthetase are a novel monogenic cause of IBD, which should be considered, particularly in infants and children with a history of neonatal hepatitis and very early-onset IBD poorly responsive to treatment.<br>Key Words: Inflammatory bowel disease, Hepatitis, Gene, Cytosolic isoleucine tRNA synthase<br>Core tip: Consider cytosolic isoleucyl-tRNA synthetase in children presenting with neonatal hepatitis and refractory very early-onset inflammatory bowel disease.|hepatitis|['Hepatitis', 'Liver inflammation']|0.0|None|1.0|0.9798366|CONCLUSION|1368.0
Cytokine assays demonstrated markedly elevated IL-2, IL-5, IL-13, IL-9 and IL-10 by the patient's CD4 T-cells, while IL-17A, IL-17F, IFNb were lower, and TNFa not significantly different when compared to healthy controls.<br>. <br>. <h5>CONCLUSION</h5>. This case report provides evidence that recessive mutations in cytosolic isoleucyl-tRNA synthetase are a novel monogenic cause of IBD, which should be considered, particularly in infants and children with a history of neonatal hepatitis and very early-onset IBD poorly responsive to treatment.<br>Key Words: Inflammatory bowel disease, Hepatitis, Gene, Cytosolic isoleucine tRNA synthase<br>Core tip: Consider cytosolic isoleucyl-tRNA synthetase in children presenting with neonatal hepatitis and refractory very early-onset inflammatory bowel disease.. This case report provides evidence for a novel monogenic cause of inflammatory bowel disease that should be considered, particularly in patients with very early-onset, poor response to treatment and a history of neonatal hepatitis.<br><h5>INTRODUCTION</h5>. Aminoacyl tRNA synthetases/ligases (ARSs) are a group of 20 ubiquitously expressed, highly conserved enzymes involved in attaching each specific amino acid to a tRNA to promote protein synthesis.|1475.0|{'report'}|HP:0002037|6.0|This case report provides evidence that recessive mutations in cytosolic isoleucyl-tRNA synthetase are a novel monogenic cause of IBD, which should be considered, particularly in infants and children with a history of neonatal hepatitis and very early-onset IBD poorly responsive to treatment.<br>Key Words: Inflammatory bowel disease, Hepatitis, Gene, Cytosolic isoleucine tRNA synthase<br>Core tip: Consider cytosolic isoleucyl-tRNA synthetase in children presenting with neonatal hepatitis and refractory very early-onset inflammatory bowel disease.|Inflammatory bowel disease|['Inflammation of the large intestine', 'Inflammation of the large intestine', 'Inflammatory bowel disease']|0.0|None|1.0|0.9901862|CONCLUSION|1449.0
Cytokine assays demonstrated markedly elevated IL-2, IL-5, IL-13, IL-9 and IL-10 by the patient's CD4 T-cells, while IL-17A, IL-17F, IFNb were lower, and TNFa not significantly different when compared to healthy controls.<br>. <br>. <h5>CONCLUSION</h5>. This case report provides evidence that recessive mutations in cytosolic isoleucyl-tRNA synthetase are a novel monogenic cause of IBD, which should be considered, particularly in infants and children with a history of neonatal hepatitis and very early-onset IBD poorly responsive to treatment.<br>Key Words: Inflammatory bowel disease, Hepatitis, Gene, Cytosolic isoleucine tRNA synthase<br>Core tip: Consider cytosolic isoleucyl-tRNA synthetase in children presenting with neonatal hepatitis and refractory very early-onset inflammatory bowel disease.. This case report provides evidence for a novel monogenic cause of inflammatory bowel disease that should be considered, particularly in patients with very early-onset, poor response to treatment and a history of neonatal hepatitis.<br><h5>INTRODUCTION</h5>. Aminoacyl tRNA synthetases/ligases (ARSs) are a group of 20 ubiquitously expressed, highly conserved enzymes involved in attaching each specific amino acid to a tRNA to promote protein synthesis.|1486.0|{'report'}|HP:0012115|6.0|This case report provides evidence that recessive mutations in cytosolic isoleucyl-tRNA synthetase are a novel monogenic cause of IBD, which should be considered, particularly in infants and children with a history of neonatal hepatitis and very early-onset IBD poorly responsive to treatment.<br>Key Words: Inflammatory bowel disease, Hepatitis, Gene, Cytosolic isoleucine tRNA synthase<br>Core tip: Consider cytosolic isoleucyl-tRNA synthetase in children presenting with neonatal hepatitis and refractory very early-onset inflammatory bowel disease.|Hepatitis|['Hepatitis', 'Liver inflammation']|0.0|None|1.0|0.9798366|CONCLUSION|1477.0
The patient suffered from loose stools from early infancy which became more troublesome and persistent from five years old with ten bloody motions a day.. Repeated endoscopies showed persistent pancolitis, which was refractory to mesalazine, corticosteroids, azathioprine, sirolimus and anti-TNF (adalimumab) therapy, but has improved recently with subcutaneous methotrexate.. Whole Genome Sequencing revealed a novel pathogenic missense variant (c.290A &gt: G) in the cytosolic isoleucyl-tRNA synthetase gene, leading to an amino acid substitution (p. Asp97Gly).. Pathogenic variants in other genes associated with inflammatory bowel disease (IBD) () were excluded.. Cytokine assays demonstrated markedly elevated IL-2, IL-5, IL-13, IL-9 and IL-10 by the patient's CD4 T-cells, while IL-17A, IL-17F, IFNb were lower, and TNFa not significantly different when compared to healthy controls.<br>. <br>|865.0|{'associated'}|HP:0002037|7.0|Pathogenic variants in other genes associated with inflammatory bowel disease (IBD) () were excluded.|inflammatory bowel disease|['Inflammation of the large intestine', 'Inflammation of the large intestine', 'Inflammatory bowel disease']|0.0|None|1.0|0.9901862|CASE SUMMARY|839.0
